UIN,event_name,event_topic,event_keywords,event_type,event_role,event_start_date,event_end_date,event_other_participants,other_participants_role,event_sponsor,event_location,event_city,event_country,event_link,event_processed_timestamp,event_inserted_timestamp,event_updated_timestamp,event_processed_date,event_inserted_date,event_updated_date,event_delete_flag_timestamp,event_processed_date timestamp,event_inserted_date timestamp
KA017584,2023 India Live Cardiology Conference,Puncture in mitraclip procedure,Cardiology,Conference,Speaker,2023-03-15,2023-03-18,,,,Hotel ITC Grand Chola,Chennai,India,https://promeetings.live/Indialive2023/index5.php#tg-schedule,14:51,14:51,,2025-04-22,2025-04-22,,,2025-04-22 14:51:35,2025-04-22 14:51:35
KA017584,2023 Annual Conference of the Cardiological Society of India,Session 49 - Transcatheter Mitral Valve / Pulmonary Valve Intervention,Transcatheter Mitral Valve,Conference,Chair,2023-07-12,2023-10-12,"Praveen Chandra, Tripti Deb, Atul Mathur, Sanjeeb Roy, J Shivkumar Rao, Rajeev Bagarhatta, A B Gopalamurugan",Chair,Cardiological Society of India,ITC Royal Bengal,Kolkata,India,https://csi.org.in/frontend/assets/assets/csicon.pdf,14:51,14:51,,2025-04-22,2025-04-22,,,2025-04-22 14:51:35,2025-04-22 14:51:35
KA017584,2023 Annual Conference of the Cardiological Society of India,Session 91 - Key Note Address,Cardiology,Conference,Chair,2023-07-12,2023-10-12,"Nakul Sinha, Kirti D Tanna, Anil Kumar, H M Mardikar, N Senguttuvan, Shirish (M S) Hiremath",Chair,Cardiological Society of India,ITC Royal Bengal,Kolkata,India,https://csi.org.in/frontend/assets/assets/csicon.pdf,14:51,14:51,,2025-04-22,2025-04-22,,,2025-04-22 14:51:35,2025-04-22 14:51:35
KA017584,2023 Annual Conference of the Cardiological Society of India,Session 133 - Key Note Lecture,Cardiology,Conference,Chair,2023-07-12,2023-10-12,"Saibal Kar, Bharat Vijay Purohit, Ajit Mullasari S",Chair,Cardiological Society of India,ITC Royal Bengal,Kolkata,India,https://csi.org.in/frontend/assets/assets/csicon.pdf,14:51,14:51,,2025-04-22,2025-04-22,,,2025-04-22 14:51:35,2025-04-22 14:51:35
KA017584,2022 Annual Virtual Conference of Heart Failure Association of India,Device management of MR in HF,Heart Failure,Conference,Speaker,2022-02-11,2022-02-13,,,Heart Failure Association of India,,,,https://hfai.co.in/wp-content/uploads/2022/08/HFAI-2022-Program-11-12-13-1.pdf,14:51,14:51,,2025-04-22,2025-04-22,,,2025-04-22 14:51:35,2025-04-22 14:51:35
KA017584,2023 Cardiological Society of India - National Interventional Council (CSINIC) Mid Term Meeting,Session 4 - Structural Heart Interventions - Live Case 3 & 4,Heart Disease,Meeting,Chair,2023-06-29,2023-07-02,,,Cardiological Society of India,Hyderabad International Convention Centre Novotel,Hyderabad,India,https://www.csi.org.in/frontend/assets/assets/16th%20June%202023%20-%20CSI%20NIC%202023%20-%20Scientific%20Program.pdf,14:51,14:51,,2025-04-22,2025-04-22,,,2025-04-22 14:51:35,2025-04-22 14:51:35
KA017584,2023 Cardiological Society of India - National Interventional Council (CSINIC) Mid Term Meeting,Case in Box - Mitra Clip,Cardiology,Meeting,Speaker,2023-06-29,2023-07-02,,,Cardiological Society of India,Hyderabad International Convention Centre Novotel,Hyderabad,India,https://www.csi.org.in/frontend/assets/assets/16th%20June%202023%20-%20CSI%20NIC%202023%20-%20Scientific%20Program.pdf,14:51,14:51,,2025-04-22,2025-04-22,,,2025-04-22 14:51:35,2025-04-22 14:51:35
KA017728,2023 Cardiological Society of India - National Interventional Council (CSINIC) Mid Term Meeting,Session - Live in Box 8,Cardiology,Meeting,Chair,2023-06-29,2023-07-02,,,Cardiological Society of India,Hyderabad International Convention Centre Novotel,Hyderabad,India,https://www.csi.org.in/frontend/assets/assets/16th%20June%202023%20-%20CSI%20NIC%202023%20-%20Scientific%20Program.pdf,13:46,13:46,,2025-04-18,2025-04-18,,,2025-04-18 13:46:31,2025-04-18 13:46:31
KA017744,2023 India Live Cardiology Conference,Session 1: TAVR - Vascular Access,Cardiology,Conference,Moderator,2023-03-15,2023-03-18,"Preeti Sharma, Yash Paul Sharma, Anuj Kapadia, Paras Balghat, Shivanand S Patil, Nimit Shah, B K S Sastry",Moderator,,Hotel ITC Grand Chola,Chennai,India,https://promeetings.live/Indialive2023/index5.php#tg-schedule,14:45,14:45,,2025-04-18,2025-04-18,,,2025-04-18 14:45:58,2025-04-18 14:45:58
KA017744,2023 India Live Cardiology Conference,Bifurcation in 2023,Bifurcation,Conference,Moderator,2023-03-15,2023-03-18,"Abhishek Kumar, V J Karthikeyan, Abhijit Palshikar",Moderator,,Hotel ITC Grand Chola,Chennai,India,https://promeetings.live/Indialive2023/index5.php#tg-schedule,14:45,14:45,,2025-04-18,2025-04-18,,,2025-04-18 14:45:58,2025-04-18 14:45:58
KA017744,2025 Complex and High-risk Interventional Procedures-Chronic Total Occlusion India Conference,Heavily Calcified Coronaries – Who Blasted The Rock Best! - 5,Chronic Total Occlusion,Conference,Discussant,2025-01-30,2025-02-01,"Pranay Jain, B Khandpal",Discussant,Indian Foundation of Advanced Cardiovascular Interventions,Hotel Pullman,New Delhi,India,https://chipctoindia.com/assets/scientific-agenda.pdf,14:45,14:45,,2025-04-18,2025-04-18,,,2025-04-18 14:45:58,2025-04-18 14:45:58
KA017744,2025 Complex and High-risk Interventional Procedures-Chronic Total Occlusion India Conference,CHIP -Multivessel Calcific Intervention In Cardiogenic Shock,Intervention,Conference,Speaker,2025-01-30,2025-02-01,,,Indian Foundation of Advanced Cardiovascular Interventions,Hotel Pullman,New Delhi,India,https://chipctoindia.com/assets/scientific-agenda.pdf,14:45,14:45,,2025-04-18,2025-04-18,,,2025-04-18 14:45:58,2025-04-18 14:45:58
KA017744,2025 Complex and High-risk Interventional Procedures-Chronic Total Occlusion India Conference,Revolutionizing Coronary Interventions: PCI with reduced Metal Footprint,Percutaneous Coronary Intervention,Conference,Discussant,2025-01-30,2025-02-01,"Prabhu C Halkati, Gautam Swaroop, Imran Hafeez, Ajay Joshi",Discussant,Indian Foundation of Advanced Cardiovascular Interventions,Hotel Pullman,New Delhi,India,https://chipctoindia.com/assets/scientific-agenda.pdf,14:45,14:45,,2025-04-18,2025-04-18,,,2025-04-18 14:45:58,2025-04-18 14:45:58
KA017744,2025 Complex and High-risk Interventional Procedures-Chronic Total Occlusion India Conference,Chip Grand Master Rounds,Chronic Total Occlusion,Conference,Discussant,2025-01-30,2025-02-01,"Arvind Das, Richa Sharma, Y K Bhatta, Rajesh Pandey",Discussant,Indian Foundation of Advanced Cardiovascular Interventions,Hotel Pullman,New Delhi,India,https://chipctoindia.com/assets/scientific-agenda.pdf,14:45,14:45,,2025-04-18,2025-04-18,,,2025-04-18 14:45:58,2025-04-18 14:45:58
KA017744,2023 Platinum Jubilee Annual Conference of Cardiological Society of India,Newer Antiplatelet Drugs (Factor XI inhibitors) (10 min),Chronic Total Occlusion,Conference,Speaker,2023-12-07,2023-12-10,,,Cardiological Society of India,ITC Royal Bengal,Kolkata,India,https://csi.org.in/frontend/assets/assets/csicon.pdf,14:45,14:45,,2025-04-18,2025-04-18,,,2025-04-18 14:45:58,2025-04-18 14:45:58
KA019643,2024 5 Essential Insights on Heart Failure Podcast,5 Essential Insights on Heart Failure,Heart Failure,Podcast,Speaker,2024-03-07,2024-03-07,,,Lupin,,,,https://www.youtube.com/watch?v=koJ_nI0dsV0,14:43,14:43,,2025-04-15,2025-04-15,,,2025-04-15 14:43:12,2025-04-15 14:43:12
KA022068,2025 Annual Conference of Heart Failure Association of India,Case Of Recurrent Heart Failure - Treatment Dilemma,Heart Failure,Conference,Speaker,2025-02-07,2025-02-09,,,Heart Failure Association of India,Hotel Crowne Plaza,Kochi,India,https://scheduler.hfai2025kochi.com/day_wise_schedule1,12:34,12:34,,2025-04-22,2025-04-22,,,2025-04-22 12:34:48,2025-04-22 12:34:48
KA028073,2023 Platinum Jubilee Annual Conference of Cardiological Society of India,Lipids 3 : Advances,Cardiology,Conference,Panellist,2023-12-07,2023-12-10,,,Cardiological Society of India,ITC Royal Bengal,Kolkata,India,https://csi.org.in/frontend/assets/assets/csicon.pdf,9:23,9:23,,2025-04-20,2025-04-20,,,2025-04-20 09:23:47,2025-04-20 09:23:47
KA028073,2024 CME Programme in Internal Medicine and Dr. K S S APPA National Symposium in Cardiology,Acute PTE,Cardiology,CME,Speaker,2024-10-19,2024-10-24,,,Association of Physicians of India,Dr. K.S. Shadaksharappa Auditorium API Bhavana,Bengaluru,India,https://mert.org.in/wp-content/uploads/2024/09/Brochure.pdf,9:23,9:23,,2025-04-20,2025-04-20,,,2025-04-20 09:23:47,2025-04-20 09:23:47
KA029061,2024 Jayadeva Mitral Summit,Discussion on Cardiology,Cardiology,Summit,Speaker,2024-05-23,2024-03-25,,,"Sri Jayadeva Institute of Cardiovascular Sciences and Research, Bengaluru",Jayadeva Hospital Bengaluru,Bengaluru,India,https://www.iacts.org/sites/default/files/jayadeva_mitral_summit_-2024.pdf,15:30,15:30,,2025-04-29,2025-04-29,,,2025-04-29 15:30:27,2025-04-29 15:30:27
KA029061,2023 Bengaluru Ozaki Summit,Discussion on Cardiology,Cardiology,Summit,Faculty,2023-05-18,2023-05-18,,,"Sri Jayadeva Institute of Cardiovascular Sciences and Research, Bengaluru",,Bengaluru,India,https://www.iacts.org/sites/default/files/ozaki_summit_2023-_updated_scientific_brochure.pdf,15:30,15:30,,2025-04-29,2025-04-29,,,2025-04-29 15:30:27,2025-04-29 15:30:27
KA031982,2023 Annual Conference of Indian College of Cardiology,Discussion on Cardiology,Cardiology,Conference,Speaker,2023-09-29,2023-10-01,,,Indian College of Cardiology,Hotel ITC Gardenia,Bengaluru,India,https://promeetings.live/icccon/,9:05,9:05,,2025-04-17,2025-04-17,,,2025-04-17 09:05:48,2025-04-17 09:05:48
KA031982,2025 Sentient Summit National Conference,The Uncrossable Aortic Valve,Uncrossable Aortic Valve,Conference,Speaker,2025-01-16,2025-01-18,,,Sentient Summit,Taj Fisherman's Cove,Chennai,India,https://www.sentientsummit.com/scientific-program-2025/,9:05,9:05,,2025-04-17,2025-04-17,,,2025-04-17 09:05:48,2025-04-17 09:05:48
KA031982,2023 Society for Coronary Imaging and Physiology National Conference,Discussion on Cardiology,Cardiology,Conference,Speaker,2023-11-25,2023-11-25,,,Cardiological Society of India,ITC Royal Bengal,Kolkata,India,https://www.linkedin.com/posts/dr-anusha-rao-506462268_scip-2023-itc-gardenia-bangalore-activity-7134288609649561600-ZgNs/,9:05,9:05,,2025-04-17,2025-04-17,,,2025-04-17 09:05:48,2025-04-17 09:05:48
KA031982,2025 Complex and High-risk Interventional Procedures-Chronic Total Occlusion India Conference,All's Well That Ends Well,Chronic Total Occlusion,Conference,Speaker,2025-01-30,2025-02-01,,,Indian Foundation of Advanced Cardiovascular Interventions,Hotel Pullman,New Delhi,India,https://chipctoindia.com/assets/scientific-agenda.pdf,9:05,9:05,,2025-04-17,2025-04-17,,,2025-04-17 09:05:48,2025-04-17 09:05:48
KA031982,2023 Cardiological Society of India - National Interventional Council (CSINIC) Mid Term Meeting,The Giant Aneurysm,Cardiology,Meeting,Speaker,2023-06-29,2023-07-02,,,Cardiological Society of India,Hyderabad International Convention Centre Novotel,Hyderabad,India,https://www.csi.org.in/frontend/assets/assets/16th%20June%202023%20-%20CSI%20NIC%202023%20-%20Scientific%20Program.pdf,9:05,9:05,,2025-04-17,2025-04-17,,,2025-04-17 09:05:48,2025-04-17 09:05:48
KA031982,2022 Imaging and Physiology Council of India National Conference,Discussion on Cardiology,Cardiology,Conference,Speaker,2022-08-12,2022-08-12,,,Indian Radiological and Imaging Association,Shri BM Patil Medical College Hospital & Research Centre,Vijayapura,India,https://www.manipalhospitals.com/oldairportroad/doctors/dr-anusha-a-rao-cardiologist/,9:05,9:05,,2025-04-17,2025-04-17,,,2025-04-17 09:05:48,2025-04-17 09:05:48
KA031982,2022 Society for Coronary Imaging and Physiology National Conference,Discussion on Cardiology,Cardiology,Conference,Speaker,2022-12-08,2022-12-08,,,"AccuKardia, Inc",,San Francisco,United States,https://www.manipalhospitals.com/oldairportroad/doctors/dr-anusha-a-rao-cardiologist/,9:05,9:05,,2025-04-17,2025-04-17,,,2025-04-17 09:05:48,2025-04-17 09:05:48
KA031982,2022 Cardiological Society Of India - Karnataka Chapter Conference,Discussion on Cardiology,Cardiology,Conference,Speaker,2022-12-08,2022-12-08,,,Cardiology Society of India - Karnataka Chapter,,,,https://www.manipalhospitals.com/oldairportroad/doctors/dr-anusha-a-rao-cardiologist/,9:05,9:05,,2025-04-17,2025-04-17,,,2025-04-17 09:05:48,2025-04-17 09:05:48
KA031982,2023 Complex High-Risk Interventional Procedures - Chronic Total Occlusion Scientific Program,Discussion on Cardiology,Cardiology,Meeting,Speaker,2023-01-27,2023-01-29,,,Indian Foundation of Advanced Cardiovascular Interventions,Hotel Pullman,New Delhi,India,https://www.manipalhospitals.com/oldairportroad/doctors/dr-anusha-a-rao-cardiologist/,9:05,9:05,,2025-04-17,2025-04-17,,,2025-04-17 09:05:48,2025-04-17 09:05:48
KA031982,2023 India Live Cardiology Conference,Stuck Burr,Cardiology,Conference,Speaker,2023-03-15,2023-03-18,,,,Hotel ITC Grand Chola,Chennai,India,https://promeetings.live/Indialive2023/index5.php#tg-schedule,9:05,9:05,,2025-04-17,2025-04-17,,,2025-04-17 09:05:48,2025-04-17 09:05:48
KA031982,2023 Annual Meeting of the European Association of Percutaneous Cardiovascular Interventions,Discussion on Cardiology,Cardiology,Conference,Speaker,2023-05-16,2023-05-16,,,European Society of Cardiology,Palais des congrčs de Paris,Paris,France,https://www.manipalhospitals.com/oldairportroad/doctors/dr-anusha-a-rao-cardiologist/,9:05,9:05,,2025-04-17,2025-04-17,,,2025-04-17 09:05:48,2025-04-17 09:05:48
KA031982,2023 BEAT Cardiology Meet,Discussion on Cardiology,Cardiology,Conference,Speaker,2023-03-27,2023-03-27,,,,Jio World Convention Centre,London,United Kingdom,https://www.manipalhospitals.com/oldairportroad/doctors/dr-anusha-a-rao-cardiologist/,9:05,9:05,,2025-04-17,2025-04-17,,,2025-04-17 09:05:48,2025-04-17 09:05:48
KA031982,2024 Conference of Bifurcation Club of India,Discussion on Cardiology,Cardiology,Conference,Speaker,2024-07-06,2024-07-06,,,Veiva Scientific India Pvt Ltd,"Hotel Tej, Santacruz",Mumbai,India,https://www.manipalhospitals.com/oldairportroad/doctors/dr-anusha-a-rao-cardiologist/,9:05,9:05,,2025-04-17,2025-04-17,,,2025-04-17 09:05:48,2025-04-17 09:05:48
KA035832,2024 National Conference on Emerging Excellence in Cardiac Care,Emerging excellence in cardiac care,Cardiac Disease,Conference,Speaker,2024-04-25,2024-04-26,,,Anandha Arangam,,,,https://pcnr.paavai.edu.in/wp-content/uploads/2024/07/Events-in-PCNR-2023-20241.pdf,18:34,18:34,,2025-04-19,2025-04-19,,,2025-04-19 18:34:47,2025-04-19 18:34:47
KA037617,2024 Jayadeva Mitral Summit,Discussion on Cardiology,Cardiology,Summit,Speaker,2024-05-23,2024-03-25,,,"Sri Jayadeva Institute of Cardiovascular Sciences and Research, Bengaluru",Jayadeva Hospital Bengaluru,Bengaluru,India,https://www.iacts.org/sites/default/files/jayadeva_mitral_summit_-2024.pdf,14:24,14:24,,2025-04-29,2025-04-29,,,2025-04-29 14:24:53,2025-04-29 14:24:53
KA038839,2021 In-Depth & Comprehensive Interventional Cardiology Virtual Meeting,Discussion on Cardiology,Cardiology,Meeting,Faculty,2021-12-02,2021-02-13,,,S K Heart Foundation,,,,https://drvtshah.com/images/lectures/2021/12-13-feb-2021-virtual-meeting.pdf,18:19,18:19,,2025-04-15,2025-04-15,,,2025-04-15 18:19:10,2025-04-15 18:19:10
KA038839,2020 Webinar Series on Expert Learning Session Interventional Cardiology - December,Interventional Cardiology Insights,Cardiology,Webinar,Speaker,2020-12-05,2020-12-05,,,Sushant School of Health Science,,,,https://sushantuniversity.edu.in/admin-assets/uploaddata/icr001.png,18:19,18:19,,2025-04-15,2025-04-15,,,2025-04-15 18:19:10,2025-04-15 18:19:10
KA038839,2020 Webinar Series on Expert Learning Session Interventional Cardiology - December,Scope and Career Path,Interventional Cardiology,Webinar,Speaker,2020-12-05,2020-12-05,,,Sushant School of Health Science,,,,https://sushantuniversity.edu.in/admin-assets/uploaddata/icr001.png,18:19,18:19,,2025-04-15,2025-04-15,,,2025-04-15 18:19:10,2025-04-15 18:19:10
KA038839,2020 Webinar Series on Expert Learning Session Interventional Cardiology - May,Roles and Responsibilities of Cardiovascular Technologist (including Q&A),Interventional Cardiology,Webinar,Speaker,2020-05-13,2020-05-13,,,Sushant School of Health Science,,,,https://sushantuniversity.edu.in/admin-assets/uploaddata/icr001.png,18:19,18:19,,2025-04-15,2025-04-15,,,2025-04-15 18:19:10,2025-04-15 18:19:10
KA038839,2025 CME Seminar of PAN India,Highlights the Importance of Nutrition Based Intervention into Healthcare Systems to Prevent & Treat Non-Communicable Diseases,Intervention,CME,Speaker,2025-01-15,2025-01-15,,,,,,,https://www.youtube.com/watch?v=KwqCUqaUr1o,18:19,18:19,,2025-04-15,2025-04-15,,,2025-04-15 18:19:10,2025-04-15 18:19:10
KA038860,2024 Annual Women Cardiac Care Conference,A story of complicated Left Main bifurcation stenting,Bifurcation,Conference,Speaker,2024-03-23,2024-03-23,,,Women In Cardiology And Related Sciences (WINCARS) Association,Novotel Hotel,Visakhapatnam,India,https://wincarsassociation.com/public/front/pdf/Case-presentations-WCC-2024.pdf,17:25,17:25,,2025-04-15,2025-04-15,,,2025-04-15 17:25:25,2025-04-15 17:25:25
KA040203,2023 Platinum Jubilee Annual Conference of Cardiological Society of India,Fascicular VT ablation,Cardiology,Conference,Speaker,2023-12-07,2023-12-10,,,Cardiological Society of India,ITC Royal Bengal,Kolkata,India,https://csi.org.in/frontend/assets/assets/csicon.pdf,13:28,13:28,,2025-04-21,2025-04-21,,,2025-04-21 13:28:06,2025-04-21 13:28:06
KA040203,2024 CME Programme in Internal Medicine and Dr. K S S APPA National Symposium in Cardiology,ECG,Cardiology,CME,Speaker,2024-10-19,2024-10-24,,,Association of Physicians of India,Dr. K.S. Shadaksharappa Auditorium API Bhavana,Bengaluru,India,https://mert.org.in/wp-content/uploads/2024/09/Brochure.pdf,13:28,13:28,,2025-04-21,2025-04-21,,,2025-04-21 13:28:06,2025-04-21 13:28:06
KA040203,2023 Asia Pacific Heart Rhythm Society Scientific Session,Advances in cardiac monitoring for diagnosing Syncope/Collapse,Cardiac Disease,Conference,Speaker,2023-09-01,2023-09-03,,,Asia Pacific Heart Rhythm Society,Hong Kong Convention & Exhibition Centre,Wan Chai,Hong Kong,https://aphrs-cardiorhythm2023hk.com/APHRS2023-e-programme.pdf,13:28,13:28,,2025-04-21,2025-04-21,,,2025-04-21 13:28:06,2025-04-21 13:28:06
KA040203,2023 Asia Pacific Heart Rhythm Society Scientific Session,ECG Interpretations,Heart Disease,Conference,Chair,2023-09-01,2023-09-03,,,Asia Pacific Heart Rhythm Society,Hong Kong Convention & Exhibition Centre,Wan Chai,Hong Kong,https://aphrs-cardiorhythm2023hk.com/APHRS2023-e-programme.pdf,13:28,13:28,,2025-04-21,2025-04-21,,,2025-04-21 13:28:06,2025-04-21 13:28:06
KA040203,2023 Asia Pacific Heart Rhythm Society Scientific Session,Polymorphic PVC Induced Cardiomyopathy: Atrium as a Vantage Point,Cardiology,Conference,Speaker,2023-09-01,2023-09-03,,,Asia Pacific Heart Rhythm Society,Hong Kong Convention & Exhibition Centre,Wan Chai,Hong Kong,https://aphrs-cardiorhythm2023hk.com/APHRS2023-e-programme.pdf,13:28,13:28,,2025-04-21,2025-04-21,,,2025-04-21 13:28:06,2025-04-21 13:28:06
KA040203,2023 ECG CME and Workshop on The Surgical and Neuro Intensive Care Unit of Anesthesiology,The Surgical and Neuro Intensive Care Unit of Anesthesiology,Anesthesiology,Workshop,Speaker,2023-06-03,2023-06-03,,,St. John's Medical College and Hospital,,,,https://www.stjohns.in/hospital/pdf/Whatsup_StJohns_Issue73_01_07_2023.pdf,13:28,13:28,,2025-04-21,2025-04-21,,,2025-04-21 13:28:06,2025-04-21 13:28:06
KA041008,2024 Annual Conference of Research Society for the Study of Diabetes in India and International Diabetes Federation Southeast Asia Region Diabetes Congress,Aid For Type 1 Diabetes - Should Be Offered To All Children With T1D,Diabetes,Conference,Chair,2024-11-14,2024-11-17,"Manoj Chawla, Amit Gupta",Chair,Research Society for the Study of Diabetes in India,Yashobhoomi,Dwarka,India,https://www.rssdi.in/newwebsite/pdfdata/RSSDI-2024-Scientific-Program.pdf,9:50,9:50,,2025-04-25,2025-04-25,,,2025-04-25 09:50:49,2025-04-25 09:50:49
KA041008,2025 World Congress of Diabetes,Advancing Insulin Therapy,Insulin,Congress,Chair,2025-02-13,2025-02-16,"Rashmi Ranjan Mohanty, Syed A A Javaz",Chair,Diabetes in Asia Study Group (DASG),Forum Convention & Celebration Centre,Ahmedabad,India,https://2025.diabetesindia.org.in/wp-content/uploads/2025/01/DI-2025_Scientific-Agenda.pdf,9:50,9:50,,2025-04-25,2025-04-25,,,2025-04-25 09:50:49,2025-04-25 09:50:49
KA041008,2025 Annual Conference of the Association of Physicians of India,Minimizing Errors In ICU,Health Care,Conference,Chair,2025-01-23,2025-01-26,,,Association of Physicians of India,Biswa Bangla Mela Prangan,Kolkata,India,https://apiindia.org/assets/files/APICON%202025%20KOLKATA%20PROGRAMME-1.pdf,9:50,9:50,,2025-04-25,2025-04-25,,,2025-04-25 09:50:49,2025-04-25 09:50:49
KA041008,2023 Annual National Conference of the Association of Physicians of India,Update Session,Health Care,Conference,Chair,2023-01-26,2023-01-29,,,Association of Physicians of India,,Mumbai,India,https://journal-api.s3.ap-south-1.amazonaws.com/issues/January2023.pdf,9:50,9:50,,2025-04-25,2025-04-25,,,2025-04-25 09:50:49,2025-04-25 09:50:49
KA041008,2024 Annual Conference of Research Society for the Study of Diabetes in India and International Diabetes Federation Southeast Asia Region Diabetes Congress,Understanding AID,Diabetes,Conference,Chair,2024-11-14,2024-11-17,,,Research Society for the Study of Diabetes in India,Yashobhoomi,Dwarka,India,https://rssdi2024delhi.com/pdf/rssdi-2024-brochure.pdf,9:50,9:50,,2025-04-25,2025-04-25,,,2025-04-25 09:50:49,2025-04-25 09:50:49
KA041008,2024 Annual Conference of Research Society for the Study of Diabetes in India and International Diabetes Federation Southeast Asia Region Diabetes Congress,Aid For Type 1 Diabetes - Should Be Offered To All Children With T1D,Diabetes,Conference,Chair,2024-11-14,2024-11-17,,,Research Society for the Study of Diabetes in India,Yashobhoomi,Dwarka,India,https://rssdi2024delhi.com/pdf/rssdi-2024-brochure.pdf,9:50,9:50,,2025-04-25,2025-04-25,,,2025-04-25 09:50:49,2025-04-25 09:50:49
KA041008,2024 Annual Conference of Research Society for the Study of Diabetes in India and International Diabetes Federation Southeast Asia Region Diabetes Congress,"AID for Type 2 Diabetes and GDM - When, Why and How to Use?",Diabetes,Conference,Chair,2024-11-14,2024-11-17,,,Research Society for the Study of Diabetes in India,Yashobhoomi,Dwarka,India,https://rssdi2024delhi.com/pdf/rssdi-2024-brochure.pdf,9:50,9:50,,2025-04-25,2025-04-25,,,2025-04-25 09:50:49,2025-04-25 09:50:49
KA043588,2023 India Live Cardiology Conference,Paravalvular Leak Closure - Apical Approach for Device Deployment,Cardiology,Conference,Speaker,2023-03-15,2023-03-18,,,,Hotel ITC Grand Chola,Chennai,India,https://promeetings.live/Indialive2023/index5.php,17:37,17:37,,2025-04-15,2025-04-15,,,2025-04-15 17:37:16,2025-04-15 17:37:16
KA043588,2023 Cardiological Society of India - National Interventional Council (CSINIC) Mid Term Meeting,DK Crush in SKS,Cardiology,Meeting,Speaker,2023-06-29,2023-07-02,,,Cardiological Society of India,Hyderabad International Convention Centre Novotel,Hyderabad,India,https://www.csi.org.in/frontend/assets/assets/16th%20June%202023%20-%20CSI%20NIC%202023%20-%20Scientific%20Program.pdf,17:37,17:37,,2025-04-15,2025-04-15,,,2025-04-15 17:37:16,2025-04-15 17:37:16
KA043588,2023 Cardiological Society of India - National Interventional Council (CSINIC) Mid Term Meeting,Nightmare in Cathlab,Cardiology,Meeting,Speaker,2023-06-29,2023-07-02,,,Cardiological Society of India,Hyderabad International Convention Centre Novotel,Hyderabad,India,https://www.csi.org.in/frontend/assets/assets/16th%20June%202023%20-%20CSI%20NIC%202023%20-%20Scientific%20Program.pdf,17:37,17:37,,2025-04-15,2025-04-15,,,2025-04-15 17:37:16,2025-04-15 17:37:16
KA043588,2023 Cardiological Society of India - National Interventional Council (CSINIC) Mid Term Meeting,Paravalvular Leak Closure,Cardiology,Meeting,Speaker,2023-06-29,2023-07-02,,,Cardiological Society of India,Hyderabad International Convention Centre Novotel,Hyderabad,India,https://www.csi.org.in/frontend/assets/assets/16th%20June%202023%20-%20CSI%20NIC%202023%20-%20Scientific%20Program.pdf,17:37,17:37,,2025-04-15,2025-04-15,,,2025-04-15 17:37:16,2025-04-15 17:37:16
KA043588,2024 Cardiological Society of India - National Intervention Council Mid Term Meeting,Challenging CD Presentation - Bifurcation PCI,Percutaneous Coronary Intervention,Meeting,Chair,2024-07-05,2024-07-07,,,Cardiological Society of India,Chennai Trade Centre,Chennai,India,https://www.cs-tc.org/assets/img/blog/CSI%20NIC%20-%202024.pdf,17:37,17:37,,2025-04-15,2025-04-15,,,2025-04-15 17:37:16,2025-04-15 17:37:16
KA044259,2025 Diet for Diabetics Webinar,Discussion on Diabetes,Diabetes,Webinar,Panellist,2025-01-24,2025-01-24,Mahesh D M,Panellist,Happiest Health,,,,https://www.youtube.com/watch?v=bvTwO1Zu0u8,16:40,16:40,,2025-04-24,2025-04-24,,,2025-04-24 16:40:54,2025-04-24 16:40:54
KA482015,2023 Platinum Jubilee Annual Conference of Cardiological Society of India,Session 75 - Lipids 3 : Advances,Cardiology,Conference,Chair,2023-12-07,2023-12-10,"Raman Puri, Boerge Nordestgaard, Nitin Kabra, M Chokkalingam, Sunil Kr Modi, Reeta Varyani",Chair,Cardiological Society of India,ITC Royal Bengal,Kolkata,India,https://csi.org.in/frontend/assets/assets/csicon.pdf,18:24,18:24,,2025-04-16,2025-04-16,,,2025-04-16 18:24:46,2025-04-16 18:24:46
KL000183,2025 International Congress on Cardiac Problems in Pregnancy,Extracorporeal Membrane Oxygenation (ECMO) as a Lifesaving Intervention in Peripartum Cardiomyopathy with Cardiogenic Shock: Successful Outcome in Two Patients,Intervention,Congress,Speaker,2025-04-24,2025-04-27,,,Biohaven,Intercontinental Hotel,Vienna,Austria,https://cppcongress.com/wp-content/uploads/2025/04/Advanced-Program-CPP-2025-240425_Cuberoo-1.pdf,18:48,18:48,,2025-04-16,2025-04-16,,,2025-04-16 18:48:08,2025-04-16 18:48:08
