UIN,event_name,event_topic,event_keywords,event_type,event_role,event_start_date,event_end_date,event_other_participants,other_participants_role,event_sponsor,event_location,event_city,event_country,event_link,event_processed_timestamp,event_inserted_timestamp,event_updated_timestamp,event_processed_date,event_inserted_date,event_updated_date,event_delete_flag_timestamp,event_processed_date timestamp,event_inserted_date timestamp
WB005338,2025 Annual Conference of the Association of Physicians of India,"Two Faces, One Mystery: Diagnostic Crossroads Between Tumefactive Multiple Sclerosis And Glioblastoma",Glioblastoma,Conference,Chair,2025-01-23,2025-01-26,,,Association of Physicians of India,Biswa Bangla Mela Prangan,Kolkata,India,https://apiindia.org/assets/files/APICON%202025%20KOLKATA%20PROGRAMME-1.pdf,10:51,10:51,,2025-04-28,2025-04-28,,,2025-04-28 10:51:49,2025-04-28 10:51:49
WB005338,2025 Annual Conference of the Association of Physicians of India,Vitamin D & Autoimmune rheumatic diseases,Autoimmune Rheumatic Diseases,Conference,Speaker,2025-01-23,2025-01-26,,,Association of Physicians of India,Biswa Bangla Mela Prangan,Kolkata,India,https://apiindia.org/assets/files/APICON%202025%20KOLKATA%20PROGRAMME-1.pdf,10:51,10:51,,2025-04-28,2025-04-28,,,2025-04-28 10:51:49,2025-04-28 10:51:49
WB007530,2025 Women's Health Summit,A Focus on Digital Sedentary Lifestyle and Its Health Impacts,Health Care,Summit,Panellist,2025-02-22,2025-02-22,,,,Hotel Visitel,Kolkata,India,https://womantimes.in/womens-health-summit-2025-empowers-women-with-health-awareness/,16:37,16:37,,2025-04-26,2025-04-26,,,2025-04-26 16:37:05,2025-04-26 16:37:05
WB011842,2023 Two days International Medical Conference APICON and SAPICON,Discussion on Medicine,Health Care,Conference,Speaker,2023-05-20,2023-05-20,,,Association of Physicians of India North Bengal Unit,Montana Vista,Siliguri,India,https://ibgnews.com/2023/05/24/a-two-day-international-medical-conference-apinbcon-and-sapicon-2023-was-held-at-siliguri/,13:53,13:53,,2025-04-20,2025-04-20,,,2025-04-20 13:53:38,2025-04-20 13:53:38
WB011975,2024 Annual Virtual Conference on Bridging Gaps and Building Knowledge in Diabetes Education,Glycemic Sixer: From Tools To Target,Diabetes,Conference,Speaker,2024-12-14,2024-12-15,,,Association of Diabetes Educators,,,,https://www.diabeteseducatorsindia.com/uploads/news/pdfs/adecon-202414th--15th-december-2024-26.pdf,16:21,16:21,,2025-04-18,2025-04-18,,,2025-04-18 16:21:40,2025-04-18 16:21:40
WB011975,2024 Annual General Body Meeting of the Indian College of Physicians,Discussion On General Body,Health Care,Meeting,Speaker,2024-02-22,2024-02-22,,,Indian College of Physicians,,New Delhi,India,https://apiindia.org/assets/files/36th%20AGM%20ICP%20Final%20for%20Website.pdf,16:21,16:21,,2025-04-18,2025-04-18,,,2025-04-18 16:21:40,2025-04-18 16:21:40
WB016276,2025 Cardiovascular Summit Transcatheter Cardiovascular Therapeutics Asia Pacific,"RSVG Angioplasty for Distal De-Novo Lesion Using Drug Eluting Stent and Proximal ISR Using Drug Coated Balloon in an Elderly Patient With NSTEMI, Post CABG Status With Mild LV Dysfunction and CKD",STEMI,Summit,Speaker,2025-04-23,2025-04-26,,,CardioVascular Research Foundation,COEX Convention & Exhibition Center,Seoul,South Korea,https://www.sciencedirect.com/journal/journal-of-the-american-college-of-cardiology/vol/85/issue/15/suppl/S?page-size=100&page=3,18:47,18:47,,2025-04-22,2025-04-22,,,2025-04-22 18:47:24,2025-04-22 18:47:24
WB016276,2023 Platinum Jubilee Annual Conference of Cardiological Society of India,Coronary Physiology,Coronary Syndrome,Conference,Chair,2023-12-07,2023-12-10,,,Cardiological Society of India,ITC Royal Bengal,Kolkata,India,https://csi.org.in/frontend/assets/assets/csicon.pdf,18:47,18:47,,2025-04-22,2025-04-22,,,2025-04-22 18:47:24,2025-04-22 18:47:24
WB016276,2023 Platinum Jubilee Annual Conference of Cardiological Society of India,LAA Occlusion,Cardiology,Conference,Chair,2023-12-07,2023-12-10,,,Cardiological Society of India,ITC Royal Bengal,Kolkata,India,https://csi.org.in/frontend/assets/assets/csicon.pdf,18:47,18:47,,2025-04-22,2025-04-22,,,2025-04-22 18:47:24,2025-04-22 18:47:24
WB017858,2023 Platinum Jubilee Annual Conference of Cardiological Society of India,Session 29 - CIED,Cardiology,Conference,Chair,2023-12-07,2023-12-10,"C Sridevi, V K Ajit Kumar, Nitish Naik, Siddhartha Mani, K K Saxena",Chair,Cardiological Society of India,ITC Royal Bengal,Kolkata,India,https://csi.org.in/frontend/assets/assets/csicon.pdf,14:05,14:05,,2025-04-17,2025-04-17,,,2025-04-17 14:05:06,2025-04-17 14:05:06
WB018322,2023 Platinum Jubilee Annual Conference of Cardiological Society of India,Adult Congenital Heart Disease,Heart Disease,Conference,Panellist,2023-12-07,2023-12-10,,,Cardiological Society of India,ITC Royal Bengal,Kolkata,India,https://csi.org.in/frontend/assets/assets/csicon.pdf,9:34,9:34,,2025-04-27,2025-04-27,,,2025-04-27 09:34:45,2025-04-27 09:34:45
WB018322,2023 Platinum Jubilee Annual Conference of Cardiological Society of India,Case Studies : Echo & MMI,Echocardiography,Conference,Panellist,2023-12-07,2023-12-10,,,Cardiological Society of India,ITC Royal Bengal,Kolkata,India,https://csi.org.in/frontend/assets/assets/csicon.pdf,9:34,9:34,,2025-04-27,2025-04-27,,,2025-04-27 09:34:45,2025-04-27 09:34:45
WB018322,2025 Annual Conference of the Association of Physicians of India,Approach to a case of PND,Health Care,Conference,Chair,2025-01-23,2025-01-26,,,Association of Physicians of India,Biswa Bangla Mela Prangan,Kolkata,India,https://apiindia.org/assets/files/APICON%202025%20KOLKATA%20PROGRAMME-1.pdf,9:34,9:34,,2025-04-27,2025-04-27,,,2025-04-27 09:34:45,2025-04-27 09:34:45
WB020678,2023 Platinum Jubilee Annual Conference of Cardiological Society of India,Discussion on Cardiology,Cardiology,Conference,Speaker,2023-12-07,2023-12-10,,,Cardiological Society of India,ITC Royal Bengal,Kolkata,India,https://csi.org.in/frontend/assets/assets/csicon.pdf,9:33,9:33,,2025-04-27,2025-04-27,,,2025-04-27 09:33:27,2025-04-27 09:33:27
WB020678,2023 Platinum Jubilee Annual Conference of Cardiological Society of India,Localization and Management of VT,Cardiology,Conference,Panellist,2023-12-07,2023-12-10,,,Cardiological Society of India,ITC Royal Bengal,Kolkata,India,https://csi.org.in/frontend/assets/assets/csicon.pdf,9:33,9:33,,2025-04-27,2025-04-27,,,2025-04-27 09:33:27,2025-04-27 09:33:27
WB020678,2023 Platinum Jubilee Annual Conference of Cardiological Society of India,Case in the Box,Cardiology,Conference,Panellist,2023-12-07,2023-12-10,,,Cardiological Society of India,ITC Royal Bengal,Kolkata,India,https://csi.org.in/frontend/assets/assets/csicon.pdf,9:33,9:33,,2025-04-27,2025-04-27,,,2025-04-27 09:33:27,2025-04-27 09:33:27
WB020678,2025 Annual Conference of the Association of Physicians of India,Panel Discussion- Anticoagulant and antiplatelets during acute gastrointestinal bleeding in a cardiac patient,Cardiac Disease,Conference,Panellist,2025-01-23,2025-01-26,,,Association of Physicians of India,Biswa Bangla Mela Prangan,Kolkata,India,https://apiindia.org/assets/files/APICON%202025%20KOLKATA%20PROGRAMME-1.pdf,9:33,9:33,,2025-04-27,2025-04-27,,,2025-04-27 09:33:27,2025-04-27 09:33:27
WB021370,2025 Annual Conference of the Association of Physicians of India,Bone and Kidney - The interlink,Bone Disease,Conference,Speaker,2025-01-23,2025-01-26,,,Association of Physicians of India,Biswa Bangla Mela Prangan,Kolkata,India,https://apiindia.org/assets/files/APICON%202025%20KOLKATA%20PROGRAMME-1.pdf,16:31,16:31,,2025-04-15,2025-04-15,,,2025-04-15 16:31:57,2025-04-15 16:31:57
WB021370,2022 Annual Conference of North Eastern Diabetes Society,Preconception Care of Women with Diabetes,Diabetes,Conference,Speaker,2022-11-11,2022-11-13,,,North Eastern Diabetes Society,Hotel Vivanta,Guwahati,India,https://neds.in/admin/myfiles/nedscon_brochure_2022_new.pdf,16:31,16:31,,2025-04-15,2025-04-15,,,2025-04-15 16:31:57,2025-04-15 16:31:57
WB021370,2025 Annual Scientific Conference of the Integrated Diabetes and Endocrine Academy,Glycaemia Management of Hospitalized Patients,Diabetes,Conference,Speaker,2024-07-04,2024-07-07,,,Integrated Diabetes and Endocrine Academy,ITC Royal Bengal,Kolkata,India,https://www.ideacon.in/day2_program.php,16:31,16:31,,2025-04-15,2025-04-15,,,2025-04-15 16:31:57,2025-04-15 16:31:57
WB021370,"2024 T-ENDOCON of Department Of Endocrinology, Medical College Thiruvananthapuram",Difficult cases of Thyrotoxicosis,Thyrotoxicosis,CME,Speaker,2024-08-24,2024-08-25,,,Travancore Endocrine Associates,Uday Samudra Kovalam,Thiruvananthapuram,India,https://www.t-endocon.com/images/tendocon24.pdf,16:31,16:31,,2025-04-15,2025-04-15,,,2025-04-15 16:31:57,2025-04-15 16:31:57
WB021370,"2024 T-ENDOCON of Department Of Endocrinology, Medical College Thiruvananthapuram",Metabolic Bone Disease,Metabolic Bone Disease,CME,Speaker,2024-08-24,2024-08-25,,,Travancore Endocrine Associates,Uday Samudra Kovalam,Thiruvananthapuram,India,https://www.t-endocon.com/images/tendocon24.pdf,16:31,16:31,,2025-04-15,2025-04-15,,,2025-04-15 16:31:57,2025-04-15 16:31:57
WB021370,"2024 T-ENDOCON of Department Of Endocrinology, Medical College Thiruvananthapuram",Hypogonadism,Hypogonadism,CME,Speaker,2024-08-24,2024-08-25,,,Travancore Endocrine Associates,Uday Samudra Kovalam,Thiruvananthapuram,India,https://www.t-endocon.com/images/tendocon24.pdf,16:31,16:31,,2025-04-15,2025-04-15,,,2025-04-15 16:31:57,2025-04-15 16:31:57
WB021727,2023 National Comprehensive Multidisciplinary Medicare Conference,Approach to hypercalcemia,Hypercalcemia,Conference,Speaker,2023-06-30,2023-07-02,,,Kolkata Nurture Foundation,ITC Royal Bengal,Kolkata,India,https://knfunihealth.com/hopecon-2023/public/resources/Hopecon-2023-Day_3.pdf,14:29,14:29,,2025-04-29,2025-04-29,,,2025-04-29 14:29:30,2025-04-29 14:29:30
WB021727,2025 Annual Conference of the Association of Physicians of India,Hypothyroidism In Pregnancy - Revisited,Thyroid,Conference,Speaker,2025-01-23,2025-01-26,,,Association of Physicians of India,Biswa Bangla Mela Prangan,Kolkata,India,https://apiindia.org/assets/files/APICON%202025%20KOLKATA%20PROGRAMME-1.pdf,14:29,14:29,,2025-04-29,2025-04-29,,,2025-04-29 14:29:30,2025-04-29 14:29:30
WB021727,2025 Annual Conference of the Association of Physicians of India,D. Pituitary,Health Care,Conference,Speaker,2025-01-23,2025-01-26,,,Association of Physicians of India,Biswa Bangla Mela Prangan,Kolkata,India,https://apiindia.org/assets/files/APICON%202025%20KOLKATA%20PROGRAMME-1.pdf,14:29,14:29,,2025-04-29,2025-04-29,,,2025-04-29 14:29:30,2025-04-29 14:29:30
WB021727,2024 Bengal Diabetes Conference,Type 1 Diabetes : The dark side of the Moon,Diabetes,Conference,Speaker,2024-08-31,2024-09-01,,,Bengal Diabetes Foundation,ITC Fortune Park,Durgapur,India,https://bdfindia.org.in/wp-content/uploads/2024/08/Scientific-agenda-BDCON-2024-3-1.pdf,14:29,14:29,,2025-04-29,2025-04-29,,,2025-04-29 14:29:30,2025-04-29 14:29:30
WB021727,2023 National Comprehensive Multidisciplinary Medicare Conference,Approach to hypercalcemia,Hypercalcemia,Conference,Speaker,2023-06-30,2023-07-02,,,Kolkata Nurture Foundation,ITC Royal Bengal,Kolkata,India,https://knfunihealth.com/hopecon-2023/public/resources/Hopecon-2023-Day_3.pdf,14:29,14:29,,2025-04-29,2025-04-29,,,2025-04-29 14:29:30,2025-04-29 14:29:30
WB021727,2020 Research Society for the Study of Diabetes in India Annual Virtual Meeting,Flatten the Glycemic Curve with AGI,Diabetes,Meeting,Speaker,2020-11-26,2020-11-29,,,Research Society for the Study of Diabetes in India,,,,https://rssdi.in/branch/eventcms/website1/pdf/RSSDI_2020_Scientific_Agenda.pdf,14:29,14:29,,2025-04-29,2025-04-29,,,2025-04-29 14:29:30,2025-04-29 14:29:30
WB021727,2025 Annual Scientific Conference of the Integrated Diabetes and Endocrine Academy,Clinical Inertia and Reverse Clinical Inertia in T2DM management,Diabetes,Conference,Speaker,2024-07-04,2024-07-07,,,Integrated Diabetes and Endocrine Academy,ITC Royal Bengal,Kolkata,India,https://www.ideacon.in/day2_program.php,14:29,14:29,,2025-04-29,2025-04-29,,,2025-04-29 14:29:30,2025-04-29 14:29:30
WB021820,2024 Diabetes Update Kolkata,Sitagliptin/ Vildagliptin/ Linagliptin/ Teneligliptin- Do We Have A Choice,Diabetes,Conference,Speaker,2024-09-01,2024-09-01,,,Kolkata Diabetes Initiative & Kolkata Diabetes and Endocrinology,Hotel Taj Bengal,Kolkata,India,https://kolkatadiabetesinitiative.org/documents/43e8e76eed58053360b743b215c5244a.pdf,17:36,17:36,,2025-04-27,2025-04-27,,,2025-04-27 17:36:53,2025-04-27 17:36:53
WB021820,2023 National Comprehensive Multidisciplinary Medicare Conference,Approach to Galactorrhoea,Chronic Total Occlusion,Conference,Chair,2023-06-30,2023-07-02,Pradip Roychowdhury,Chair,Kolkata Nurture Foundation,ITC Royal Bengal,Kolkata,India,https://knfunihealth.com/hopecon-2023/public/resources/Hopecon-2023-Day_3.pdf,17:36,17:36,,2025-04-27,2025-04-27,,,2025-04-27 17:36:53,2025-04-27 17:36:53
WB021820,2023 National Comprehensive Multidisciplinary Medicare Conference,Approach to hypercalcemia,Hypercalcemia,Conference,Chair,2023-06-30,2023-07-02,Pradip Roychowdhury,Chair,Kolkata Nurture Foundation,ITC Royal Bengal,Kolkata,India,https://knfunihealth.com/hopecon-2023/public/resources/Hopecon-2023-Day_3.pdf,17:36,17:36,,2025-04-27,2025-04-27,,,2025-04-27 17:36:53,2025-04-27 17:36:53
WB021820,2023 National Comprehensive Multidisciplinary Medicare Conference,PCOS: Diagnosis and Management,Polycystic Ovary Syndrome,Conference,Chair,2023-06-30,2023-07-02,Pradip Roychowdhury,Chair,Kolkata Nurture Foundation,ITC Royal Bengal,Kolkata,India,https://knfunihealth.com/hopecon-2023/public/resources/Hopecon-2023-Day_3.pdf,17:36,17:36,,2025-04-27,2025-04-27,,,2025-04-27 17:36:53,2025-04-27 17:36:53
WB021820,2023 National Comprehensive Multidisciplinary Medicare Conference,Adrenal insufficiency: Diagnosis and Management,Adrenal insufficiency,Conference,Chair,2023-06-30,2023-07-02,Pradip Roychowdhury,Chair,Kolkata Nurture Foundation,ITC Royal Bengal,Kolkata,India,https://knfunihealth.com/hopecon-2023/public/resources/Hopecon-2023-Day_3.pdf,17:36,17:36,,2025-04-27,2025-04-27,,,2025-04-27 17:36:53,2025-04-27 17:36:53
WB021820,2023 National Comprehensive Multidisciplinary Medicare Conference,Basal insulin optimization- moving closer to the glycemic goal,Insulin,Conference,Speaker,2023-06-30,2023-07-02,,,Kolkata Nurture Foundation,ITC Royal Bengal,Kolkata,India,https://knfunihealth.com/hopecon-2023/public/resources/Hopecon-2023-Day_3.pdf,17:36,17:36,,2025-04-27,2025-04-27,,,2025-04-27 17:36:53,2025-04-27 17:36:53
WB021820,2025 Annual Conference of the Association of Physicians of India,Post-menopausal HRT,Postmenopausal Hormone Replacement Therapy,Conference,Speaker,2025-01-23,2025-01-26,,,Association of Physicians of India,Biswa Bangla Mela Prangan,Kolkata,India,https://apiindia.org/assets/files/APICON%202025%20KOLKATA%20PROGRAMME-1.pdf,17:36,17:36,,2025-04-27,2025-04-27,,,2025-04-27 17:36:53,2025-04-27 17:36:53
WB021820,2024 Bengal Diabetes Conference,Approach to Gynecomastia,Diabetes,Conference,Speaker,2024-08-31,2024-09-01,,,Bengal Diabetes Foundation,ITC Fortune Park,Durgapur,India,https://bdfindia.org.in/wp-content/uploads/2024/08/Scientific-agenda-BDCON-2024-3-1.pdf,17:36,17:36,,2025-04-27,2025-04-27,,,2025-04-27 17:36:53,2025-04-27 17:36:53
WB021820,2024 Annual Conference of Indian Thyroid Society,"Panel 7, Panel Discussion: Patient Advocacy in Thyroid disorders in India- What are the priorities?",Thyroid,Conference,Panellist,2024-09-08,2024-11-08,"Madhukar Rai, Mohan Shenoy",Panellist,Indian Thyroid Society,Holiday Inn,Lucknow,India,https://itscon2024.com/pdf/Programme.pdf,17:36,17:36,,2025-04-27,2025-04-27,,,2025-04-27 17:36:53,2025-04-27 17:36:53
WB021958,2025 Annual Conference of the Association of Physicians of India,CT Coronary Angiogram - How helpful in IHD,Coronary Syndrome,Conference,Speaker,2025-01-23,2025-01-26,,,Association of Physicians of India,Biswa Bangla Mela Prangan,Kolkata,India,https://apiindia.org/assets/files/APICON%202025%20KOLKATA%20PROGRAMME-1.pdf,11:42,11:42,,2025-04-19,2025-04-19,,,2025-04-19 11:42:04,2025-04-19 11:42:04
WB021958,2023 Annual Conference of the Cardiological Society of India,How do I quantify TR severity (12 + 3 min),Cardiology,Conference,Speaker,2023-07-12,2023-10-12,,,Cardiological Society of India,ITC Royal Bengal,Kolkata,India,https://csi.org.in/frontend/assets/assets/csicon.pdf,11:42,11:42,,2025-04-19,2025-04-19,,,2025-04-19 11:42:04,2025-04-19 11:42:04
WB021958,2023 Annual Conference of the Cardiological Society of India,Session 109 - Advances in HCM,Cardiology,Conference,Chair,2023-07-12,2023-10-12,"Ajay Bahl, O Sai Satish, Trinath Kumar Mishra, Binaya Bhusan Binakar",Chair,Cardiological Society of India,ITC Royal Bengal,Kolkata,India,https://csi.org.in/frontend/assets/assets/csicon.pdf,11:42,11:42,,2025-04-19,2025-04-19,,,2025-04-19 11:42:04,2025-04-19 11:42:04
WB021958,2024 Annual Conference of Indian Heart Rhythm Society,70Yrs male 35% PVC of RBBB and LPHB morphology in background of sinus & RBBB with LAHB-How to manage,Heart Disease,Conference,Chair,2024-11-15,2024-11-17,,,Indian Heart Rhythm Society,Novotel Hotel,Kolkata,India,https://ihrscon2024.com/assets/img/scientific-program.pdf,11:42,11:42,,2025-04-19,2025-04-19,,,2025-04-19 11:42:04,2025-04-19 11:42:04
WB021958,2024 Annual Conference of Indian Heart Rhythm Society,Parahisian VT,Heart Disease,Conference,Chair,2024-11-15,2024-11-17,,,Indian Heart Rhythm Society,Novotel Hotel,Kolkata,India,https://ihrscon2024.com/assets/img/scientific-program.pdf,11:42,11:42,,2025-04-19,2025-04-19,,,2025-04-19 11:42:04,2025-04-19 11:42:04
WB021958,2024 Annual Conference of Indian Heart Rhythm Society,Intramural VT-Mapping and ablation,Heart Disease,Conference,Chair,2024-11-15,2024-11-17,,,Indian Heart Rhythm Society,Novotel Hotel,Kolkata,India,https://ihrscon2024.com/assets/img/scientific-program.pdf,11:42,11:42,,2025-04-19,2025-04-19,,,2025-04-19 11:42:04,2025-04-19 11:42:04
WB021958,2024 Annual Conference of Indian Heart Rhythm Society,Ablation of Ventricular arrhythmia in channelopathy,Heart Disease,Conference,Chair,2024-11-15,2024-11-17,,,Indian Heart Rhythm Society,Novotel Hotel,Kolkata,India,https://ihrscon2024.com/assets/img/scientific-program.pdf,11:42,11:42,,2025-04-19,2025-04-19,,,2025-04-19 11:42:04,2025-04-19 11:42:04
WB021958,2024 Annual Conference of Indian Heart Rhythm Society,Inflammatory cardiomyopathy-entities other than sarcoidosis,Cardiology,Conference,Chair,2024-11-15,2024-11-17,,,Indian Heart Rhythm Society,Novotel Hotel,Kolkata,India,https://ihrscon2024.com/assets/img/scientific-program.pdf,11:42,11:42,,2025-04-19,2025-04-19,,,2025-04-19 11:42:04,2025-04-19 11:42:04
WB022016,2023 Platinum Jubilee Annual Conference of Cardiological Society of India,Session 89 - Live Case 13 & 14 : TAVI,Transcatheter Aortic Valve Implantation,Conference,Panellist,2023-12-07,2023-12-10,"Rufus Demel, Ravi Kumar Attuluri, Ayan Kar",Panellist,Cardiological Society of India,ITC Royal Bengal,Kolkata,India,https://csi.org.in/frontend/assets/assets/csicon.pdf,18:24,18:24,,2025-04-16,2025-04-16,,,2025-04-16 18:24:47,2025-04-16 18:24:47
WB022828,2023 Platinum Jubilee Annual Conference of Cardiological Society of India,Cardio Obstetrics,Cardiology,Conference,Chair,2023-12-07,2023-12-10,,,Cardiological Society of India,ITC Royal Bengal,Kolkata,India,https://csi.org.in/frontend/assets/assets/csicon.pdf,13:46,13:46,,2025-04-28,2025-04-28,,,2025-04-28 13:46:24,2025-04-28 13:46:24
WB022828,2023 Platinum Jubilee Annual Conference of Cardiological Society of India,Live Case 9 & 10 : Coronary,Coronary Syndrome,Conference,Panellist,2023-12-07,2023-12-10,,,Cardiological Society of India,ITC Royal Bengal,Kolkata,India,https://csi.org.in/frontend/assets/assets/csicon.pdf,13:46,13:46,,2025-04-28,2025-04-28,,,2025-04-28 13:46:24,2025-04-28 13:46:24
WB022828,2023 Cardiological Society of India - National Interventional Council (CSINIC) Mid Term Meeting,Bifurcation Stenting Lectures Session 2,Bifurcation,Meeting,Chair,2023-06-29,2023-07-02,,,Cardiological Society of India,Hyderabad International Convention Centre Novotel,Hyderabad,India,https://www.csi.org.in/frontend/assets/assets/16th%20June%202023%20-%20CSI%20NIC%202023%20-%20Scientific%20Program.pdf,13:46,13:46,,2025-04-28,2025-04-28,,,2025-04-28 13:46:24,2025-04-28 13:46:24
WB023058,2023 Platinum Jubilee Annual Conference of Cardiological Society of India,Discussion on Cardiology,Cardiology,Conference,Speaker,2023-12-07,2023-12-10,,,Cardiological Society of India,ITC Royal Bengal,Kolkata,India,https://csi.org.in/frontend/assets/assets/csicon.pdf,12:03,12:03,,2025-04-19,2025-04-19,,,2025-04-19 12:03:36,2025-04-19 12:03:36
WB023058,2023 Platinum Jubilee Annual Conference of Cardiological Society of India,Pot Pourri,Pot Pourri,Conference,Speaker,2023-12-07,2023-12-10,,,Cardiological Society of India,ITC Royal Bengal,Kolkata,India,https://csi.org.in/frontend/assets/assets/csicon.pdf,12:03,12:03,,2025-04-19,2025-04-19,,,2025-04-19 12:03:36,2025-04-19 12:03:36
WB023206,2023 Platinum Jubilee Annual Conference of Cardiological Society of India,AI & Digital Technology,Cardiology,Conference,Chair,2023-12-07,2023-12-10,,,Cardiological Society of India,ITC Royal Bengal,Kolkata,India,https://csi.org.in/frontend/assets/assets/csicon.pdf,15:52,15:52,,2025-04-15,2025-04-15,,,2025-04-15 15:52:52,2025-04-15 15:52:52
WB023206,2023 Platinum Jubilee Annual Conference of Cardiological Society of India,From hypertension to LVH to heart failure Continuum,Heart Failure,Conference,Speaker,2023-12-07,2023-12-10,,,Cardiological Society of India,ITC Royal Bengal,Kolkata,India,https://csi.org.in/frontend/assets/assets/csicon.pdf,15:52,15:52,,2025-04-15,2025-04-15,,,2025-04-15 15:52:52,2025-04-15 15:52:52
WB023206,2023 Platinum Jubilee Annual Conference of Cardiological Society of India,Introduction and Felicitation,Cardiology,Conference,Chair,2023-12-07,2023-12-10,,,Cardiological Society of India,ITC Royal Bengal,Kolkata,India,https://csi.org.in/frontend/assets/assets/csicon.pdf,15:52,15:52,,2025-04-15,2025-04-15,,,2025-04-15 15:52:52,2025-04-15 15:52:52
WB023206,2023 Platinum Jubilee Annual Conference of Cardiological Society of India,Hypertension 3 : Management,Hypertension,Conference,Chair,2023-12-07,2023-12-10,,,Cardiological Society of India,ITC Royal Bengal,Kolkata,India,https://csi.org.in/frontend/assets/assets/csicon.pdf,15:52,15:52,,2025-04-15,2025-04-15,,,2025-04-15 15:52:52,2025-04-15 15:52:52
WB023206,2023 Platinum Jubilee Annual Conference of Cardiological Society of India,CSI Position Statement,Cardiology,Conference,Chair,2023-12-07,2023-12-10,,,Cardiological Society of India,ITC Royal Bengal,Kolkata,India,https://csi.org.in/frontend/assets/assets/csicon.pdf,15:52,15:52,,2025-04-15,2025-04-15,,,2025-04-15 15:52:52,2025-04-15 15:52:52
WB023206,2023 Platinum Jubilee Annual Conference of Cardiological Society of India,Orations,Cardiology,Conference,Chair,2023-12-07,2023-12-10,,,Cardiological Society of India,ITC Royal Bengal,Kolkata,India,https://csi.org.in/frontend/assets/assets/csicon.pdf,15:52,15:52,,2025-04-15,2025-04-15,,,2025-04-15 15:52:52,2025-04-15 15:52:52
WB023206,2023 Platinum Jubilee Annual Conference of Cardiological Society of India,Ongoing Trials & Research Activity in India,Cardiology,Conference,Chair,2023-12-07,2023-12-10,,,Cardiological Society of India,ITC Royal Bengal,Kolkata,India,https://csi.org.in/frontend/assets/assets/csicon.pdf,15:52,15:52,,2025-04-15,2025-04-15,,,2025-04-15 15:52:52,2025-04-15 15:52:52
WB023206,2023 Platinum Jubilee Annual Conference of Cardiological Society of India,Discussion on Cardiology,Cardiology,Conference,Speaker,2023-12-07,2023-12-10,,,Cardiological Society of India,ITC Royal Bengal,Kolkata,India,https://csi.org.in/frontend/assets/assets/csicon.pdf,15:52,15:52,,2025-04-15,2025-04-15,,,2025-04-15 15:52:52,2025-04-15 15:52:52
WB023206,2023 Platinum Jubilee Annual Conference of Cardiological Society of India,Valedictory,Chronic Total Occlusion,Conference,Chair,2023-12-07,2023-12-10,,,Cardiological Society of India,ITC Royal Bengal,Kolkata,India,https://csi.org.in/frontend/assets/assets/csicon.pdf,15:52,15:52,,2025-04-15,2025-04-15,,,2025-04-15 15:52:52,2025-04-15 15:52:52
WB023206,2025 Annual Conference of the Association of Physicians of India,Exploring LDL-C Management challenges in very high risk ASCVD patients,Cardiovascular Disease,Conference,Speaker,2025-01-23,2025-01-26,,,Association of Physicians of India,Biswa Bangla Mela Prangan,Kolkata,India,https://apiindia.org/assets/files/APICON%202025%20KOLKATA%20PROGRAMME-1.pdf,15:52,15:52,,2025-04-15,2025-04-15,,,2025-04-15 15:52:52,2025-04-15 15:52:52
WB023206,2025 Annual Conference of the Association of Physicians of India,CCS - When to consider surgery or PCI Over and Beyond Optimal medical management ?,Percutaneous Coronary Intervention,Conference,Speaker,2025-01-23,2025-01-26,,,Association of Physicians of India,Biswa Bangla Mela Prangan,Kolkata,India,https://apiindia.org/assets/files/APICON%202025%20KOLKATA%20PROGRAMME-1.pdf,15:52,15:52,,2025-04-15,2025-04-15,,,2025-04-15 15:52:52,2025-04-15 15:52:52
WB023206,2025 Annual Conference of the Association of Physicians of India,Debate: Artificial Intelligence Will Replace Clinical Cardiology,Cardiology,Conference,Speaker,2025-01-23,2025-01-26,,,Association of Physicians of India,Biswa Bangla Mela Prangan,Kolkata,India,https://apiindia.org/assets/files/APICON%202025%20KOLKATA%20PROGRAMME-1.pdf,15:52,15:52,,2025-04-15,2025-04-15,,,2025-04-15 15:52:52,2025-04-15 15:52:52
